{
  "schema_version": "1.0",
  "enabled": false,
  "strategies": {
    "exact": {
      "enabled": true,
      "provider": "ripgrep"
    },
    "symbol": {
      "enabled": true,
      "provider": "lsp"
    },
    "architecture": {
      "enabled": true,
      "provider": "codebase-memory"
    },
    "semantic": {
      "enabled": false,
      "provider": null
    },
    "knowledge": {
      "enabled": true,
      "provider": "filesystem",
      "paths": ["knowledge", "docs", "specs", "adr"]
    }
  },
  "budgets": {
    "exact": { "max_tool_calls": 1, "max_results": 25, "max_chars": 12000 },
    "symbol": { "max_tool_calls": 2, "max_results": 25, "max_chars": 16000 },
    "architecture": { "max_tool_calls": 2, "max_results": 30, "max_chars": 20000 },
    "semantic": { "max_tool_calls": 2, "max_results": 12, "max_chars": 16000 },
    "knowledge": { "max_tool_calls": 2, "max_results": 12, "max_chars": 16000 }
  }
}
